{
  "$schema": "https://raw.githubusercontent.com/liangboqiang/TjuaeHub/main/schemas/assistant-definition.v1.schema.json",
  "schemaVersion": 1,
  "kind": "assistant",
  "runtimeId": "excel-creator",
  "name": "Excel 表格助手",
  "nameI18n": {
    "en-US": "Excel Creator",
    "zh-CN": "Excel 表格助手",
    "ru-RU": "Помощник Excel",
    "uk-UA": "Помічник Excel"
  },
  "description": "使用 内置文档工具 创建、编辑和分析专业 Excel 表格。财务模型、数据看板、追踪表和数据分析。",
  "descriptionI18n": {
    "en-US": "Create, edit, and analyze professional Excel spreadsheets with 内置文档工具. Financial models, dashboards, trackers, and data analysis.",
    "zh-CN": "使用 内置文档工具 创建、编辑和分析专业 Excel 表格。财务模型、数据看板、追踪表和数据分析。",
    "ru-RU": "Создаёт, редактирует и анализирует профессиональные таблицы Excel с помощью 内置文档工具: финансовые модели, дашборды, трекеры и анализ данных.",
    "uk-UA": "Створюйте, редагуйте та аналізуйте професійні таблиці Excel за допомогою 内置文档工具: фінансові моделі, дашборди, трекери та аналіз даних."
  },
  "rules": {
    "en-US": "rules/en-US.md",
    "ru-RU": "rules/ru-RU.md",
    "zh-CN": "rules/zh-CN.md"
  },
  "recommendedPrompts": [
    "创建一个 3 页的财务看板，包含利润表、营收分布图和差异条件格式",
    "创建一个销售管道追踪表，包含阶段统计、加权管道公式、漏斗图和销售代表业绩看板",
    "创建一个预算追踪表，包含跨表差异公式、预算对比柱状图和超支红色高亮"
  ],
  "recommendedPromptsI18n": {
    "en-US": [
      "Build a 3-sheet financial dashboard with income statement, revenue breakdown chart, and conditional formatting for variances",
      "Create a sales pipeline tracker with deal stages, weighted pipeline formulas, funnel chart, and rep performance scorecards",
      "Create a budget tracker with cross-sheet variance formulas, budget vs actuals bar chart, and color-coded over-budget highlights"
    ],
    "zh-CN": [
      "创建一个 3 页的财务看板，包含利润表、营收分布图和差异条件格式",
      "创建一个销售管道追踪表，包含阶段统计、加权管道公式、漏斗图和销售代表业绩看板",
      "创建一个预算追踪表，包含跨表差异公式、预算对比柱状图和超支红色高亮"
    ],
    "ru-RU": [
      "Собери финансовый дашборд на 3 листах: отчёт о прибылях и убытках, диаграмма структуры выручки и условное форматирование для отклонений",
      "Создай трекер воронки продаж с этапами сделок, формулами взвешенного пайплайна, воронкообразной диаграммой и карточками эффективности менеджеров",
      "Создай трекер бюджета с межлистовыми формулами отклонений, столбчатой диаграммой «план/факт» и цветовой подсветкой превышения бюджета"
    ],
    "uk-UA": [
      "Побудувати фінансовий дашборд на 3 аркуші зі звітом про прибутки, діаграмою доходів та умовним форматуванням",
      "Створити трекер продажів зі стадіями угод, формулами зваженого пайплайну та картками показників менеджерів",
      "Створити бюджетний трекер із формулами розбіжностей між аркушами та гістограмою \"бюджет проти факту\""
    ]
  },
  "skillDependencies": [],
  "avatar": {
    "type": "emoji",
    "value": "📊"
  }
}
