{
  "$schema": "https://raw.githubusercontent.com/liangboqiang/TjuaeHub/main/schemas/assistant-definition.v1.schema.json",
  "schemaVersion": 1,
  "kind": "assistant",
  "runtimeId": "pitch-deck-creator",
  "name": "路演 PPT 助手",
  "nameI18n": {
    "en-US": "Pitch Deck Creator",
    "zh-CN": "路演 PPT 助手",
    "ru-RU": "Создатель питч-деков",
    "uk-UA": "Створювач пітч-деків"
  },
  "description": "制作投资路演、产品发布和企业销售演示文稿，包含渐变设计、数据图表、竞品表格、团队页和演讲者备注。支持从种子轮到 A 轮及以上的路演。",
  "descriptionI18n": {
    "en-US": "Build investor pitch decks, product launch presentations, and enterprise sales decks with gradient designs, data charts, competitive tables, team slides, and speaker notes. Supports seed to Series A+ decks.",
    "zh-CN": "制作投资路演、产品发布和企业销售演示文稿，包含渐变设计、数据图表、竞品表格、团队页和演讲者备注。支持从种子轮到 A 轮及以上的路演。",
    "ru-RU": "Создаёт инвесторские питч-деки, презентации запусков и корпоративные продажи: градиентный дизайн, графики, таблицы конкурентов, слайды команды и заметки спикера. Подходит для стадий от seed до Series A и выше.",
    "uk-UA": "Створюйте інвесторські пітч-деки, презентації продуктів та корпоративні продажі: градієнтний дизайн, графіки, таблиці конкурентів, слайди команди та нотатки доповідача. Підходить для стадій від Seed до Series A+."
  },
  "rules": {
    "en-US": "rules/en-US.md",
    "ru-RU": "rules/ru-RU.md",
    "zh-CN": "rules/zh-CN.md"
  },
  "recommendedPrompts": [
    "为一个 B2B SaaS 数据管道创业公司制作 12 页 A 轮投资路演，包含 ARR 图表、竞品对比表、团队头像和财务预测",
    "为一个 AI 代码审查工具制作 8 页产品发布演示，包含 5 个功能图标、前后对比、客户满意度环形图和 3 档定价表",
    "为一个网络安全平台制作 10 页企业销售演示，包含 ROI 分析、雷达图竞品对比、财务影响表和实施时间线"
  ],
  "recommendedPromptsI18n": {
    "en-US": [
      "Create a 12-slide Series A investor deck for a B2B SaaS data pipeline startup with ARR charts, competitive comparison table, team avatars, and financial projections",
      "Create an 8-slide product launch deck for an AI code review tool with 5 feature icons, before/after comparison, customer satisfaction doughnut chart, and 3-tier pricing table",
      "Create a 10-slide enterprise sales deck for a cybersecurity platform with ROI analysis, radar chart vs competitors, financial impact table, and implementation timeline"
    ],
    "zh-CN": [
      "为一个 B2B SaaS 数据管道创业公司制作 12 页 A 轮投资路演，包含 ARR 图表、竞品对比表、团队头像和财务预测",
      "为一个 AI 代码审查工具制作 8 页产品发布演示，包含 5 个功能图标、前后对比、客户满意度环形图和 3 档定价表",
      "为一个网络安全平台制作 10 页企业销售演示，包含 ROI 分析、雷达图竞品对比、财务影响表和实施时间线"
    ],
    "ru-RU": [
      "Создай инвесторский питч-дек на 12 слайдов для B2B SaaS-стартапа по построению дата-пайплайнов: графики ARR, таблица сравнения с конкурентами, аватары команды и финансовые прогнозы",
      "Создай презентацию запуска продукта на 8 слайдов для инструмента AI-ревью кода: 5 иконок функций, сравнение «до/после», кольцевая диаграмма удовлетворённости клиентов и трёхуровневая таблица тарифов",
      "Создай корпоративный продающий дек на 10 слайдов для платформы кибербезопасности: анализ ROI, радарная диаграмма сравнения с конкурентами, таблица финансового влияния и график внедрения"
    ],
    "uk-UA": [
      "Створити інвесторський дек на 12 слайдів раунду A для стартапу B2B SaaS з графіками ARR, таблицею конкурентів та фінансовими прогнозами",
      "Створити 8 слайдів для запуску продукту AI code review з іконками функцій, порівнянням \"до/після\" та таблицею цін",
      "Створити 10 слайдів корпоративної презентації для платформи кібербезпеки з аналізом ROI та графіком впровадження"
    ]
  },
  "skillDependencies": [],
  "avatar": {
    "type": "emoji",
    "value": "💡"
  }
}
